product_id,product_name,product_description,regular_price,discount_price,quantity,category_id,published,product_weight,img_link,product_note,created_at
11176,"Instant Pot Air Fryer, Vortex 2QT, Touch Control Panel, 360° EvenCrisp™ Technology, Uses 95 % less Oil, 4-in-1 Appliance: Air Fry, Roast, Bake, Reheat (Vortex 1.97Litre, Black)",General those way low student protect knowledge lot particularly wear reason.,859,238.19,979,4,TRUE,8.69,https://m.media-amazon.com/images/W/WEBP_402378-T1/images/I/313WfOy8VSL._SX300_SY300_QL70_FMwebp_.jpg,Lose hope piece short buy even east imagine say table wind.,2020-02-06T05:38:46
11177,HUL Pureit Eco Water Saver Mineral RO+UV+MF AS wall mounted/Counter top Black 10L Water Purifier,Leader model effort speak gas media seat far leader which already product.,21.43,404.24,284,3,FALSE,4.22,https://m.media-amazon.com/images/W/WEBP_402378-T2/images/I/41ut+j+REdL._SY300_SX300_.jpg,Everybody fear catch almost book Mr hair seat national east.,2022-02-01T09:51:25
11178,"Livpure Glo Star RO+UV+UF+Mineraliser - 7 L Storage Tank, 15 LPH Water Purifier for Home, Black",Social but explain trip dog food weight better goal.,863.87,129.38,664,4,TRUE,3.27,https://m.media-amazon.com/images/I/319t03ZuOML._SX300_SY300_QL70_FMwebp_.jpg,Tell address Democrat wife owner arrive general.,2022-05-21T19:25:20
11179,"Philips Hi113 1000-Watt Plastic Body Ptfe Coating Dry Iron, Pack of 1",Sport later key tough evening force everybody it certain reduce share real pressure research right together age realize.,852.07,147.2,252,3,TRUE,3.75,https://images-na.ssl-images-amazon.com/images/W/WEBP_402378-T1/images/I/41EK0QNFSUL._SX300_SY300_QL70_FMwebp_.jpg,Almost into both understand program wide staff.,2022-06-07T02:16:33
11180,Kuber Industries Round Non Woven Fabric Foldable Laundry Basket|Toy Storage Basket|Cloth Storage Basket With Handles| Capicity 45 Ltr (Grey & Black)-KUBMART11446,Best view determine can them wide staff worker raise act degree everybody rate simply nothing far forget relate.,583.07,395.76,840,2,TRUE,7.14,https://m.media-amazon.com/images/I/41FQI5F2OiL._SX300_SY300_QL70_FMwebp_.jpg,World piece room senior site color class sell realize.,2021-10-22T12:02:13
11181,"Preethi MGA-502 0.4-Litre Grind and Store Jar (White), stainless steel, Set of 1",Order structure language deal participant on challenge sign factor push.,661.7,7.05,723,3,FALSE,3.11,https://m.media-amazon.com/images/I/414iVhwacbL._SX300_SY300_QL70_FMwebp_.jpg,Kitchen behind imagine parent thus land authority player more.,2023-03-25T00:29:06
11182,"Usha Aurora 1000 W Dry Iron with Innovative Tail Light Indicator, Weilburger Soleplate (White & Grey)",Position wish what consider energy city how Republican social hold.,566.8,255.4,687,2,FALSE,5.96,https://m.media-amazon.com/images/I/31W1xfnsOPL._SY300_SX300_QL70_FMwebp_.jpg,Alone break sister away decade easy reveal teach hot well family.,2022-12-29T07:41:51
11183,"ECOVACS DEEBOT N8 2-in-1 Robotic Vacuum Cleaner, 2022 New Launch, Most Powerful Suction, Covers 2000+ Sq. Ft in One Charge, Advanced dToF Technology with OZMO Mopping (DEEBOT N8) - White",News truth always central account me his picture raise minute.,733.9,190.99,283,3,TRUE,6.72,https://m.media-amazon.com/images/W/WEBP_402378-T2/images/I/31Ly7OehCGL._SX300_SY300_QL70_FMwebp_.jpg,Visit sport bed still any control not.,2021-12-18T06:09:38
11184,"Kent Gold, Optima, Gold+ Spare Kit",Dark else whose economic like later watch medical reach method see coach Mr.,209.23,291.44,630,1,TRUE,2.06,https://m.media-amazon.com/images/W/WEBP_402378-T2/images/I/41emm+fTJmL._SX300_SY300_.jpg,Both medical computer PM attention turn nothing song summer particular too without.,2022-03-30T03:47:37
11185,AVNISH Tap Water Purifier Filter Faucet 6 Layer Carbon Activated Dust Chlorine Remover Water Softener for Drinking Cartridge Alkaline Taps for Kitchen Sink Bathroom Wash Basin (6-Layer Filtration),Use consider specific agreement PM meet few tonight see born family every shake drug give.,127.06,455.61,315,2,TRUE,5.13,https://m.media-amazon.com/images/I/41jJsvzPK0L._SY445_SX342_QL70_FMwebp_.jpg,Now once military treat goal send end finally environment save five.,2020-05-13T23:40:07
11186,Khaitan ORFin Fan heater for Home and kitchen-K0 2215,Range card natural season part itself always form activity.,29.88,311.47,364,4,TRUE,6.7,https://m.media-amazon.com/images/W/WEBP_402378-T1/images/I/31B8Pd1SmLL._SX300_SY300_QL70_FMwebp_.jpg,Half common age parent couple fire difficult up.,2020-01-13T20:20:06
11187,USHA RapidMix 500-Watt Copper Motor Mixer Grinder with 3 Jars and 5 Years Warranty(Sea Green/White),Chair become machine probably drug gun phone law although notice.,425.33,124.16,62,2,TRUE,1.27,https://m.media-amazon.com/images/W/WEBP_402378-T2/images/I/41-76LhAc4S._SX300_SY300_QL70_FMwebp_.jpg,Relationship catch fire most hospital industry follow view former tend society anything.,2020-05-09T14:51:09
11188,"CSI INTERNATIONAL® Instant Water Geyser, Water Heater, Portable Water Heater, Geyser Made of First Class ABS Plastic 3KW (Red)",No between enter perhaps approach question figure future sport.,712.92,253.98,437,4,TRUE,1.02,https://m.media-amazon.com/images/I/41NJizePolL._SX300_SY300_QL70_FMwebp_.jpg,Word produce chair than inside present.,2021-08-29T07:05:15
11189,Havells Gatik Neo 400mm Pedestal Fan (Aqua Blue),Two top without book institution charge hotel third chance policy term modern put tend garden personal approach.,114.04,8.46,897,3,TRUE,7.27,https://m.media-amazon.com/images/I/31jWfV8N6+L._SY300_SX300_.jpg,Thus close three first machine also soon side relationship.,2023-04-29T21:51:40
11190,"INALSA Upright Vacuum Cleaner, 2-in-1,Handheld & Stick for Home & Office Use,800W- with 16KPA Strong Suction & HEPA Filtration|0.8L Dust Tank|Includes Multiple Accessories,(Grey/Black)",Media respond would buy house enter own professor role benefit available president right soon country kid.,738.69,111.77,669,1,TRUE,9.86,https://m.media-amazon.com/images/I/31RLcOp57gL._SX300_SY300_QL70_FMwebp_.jpg,Party bank scene check director television responsibility firm.,2021-01-26T00:36:56
11191,"ROYAL STEP - AMAZON'S BRAND - Portable Electric USB Juice Maker Juicer Bottle Blender Grinder Mixer,4 Blades Rechargeable Bottle with (Multi color) (MULTI)",Address deal however experience she person prove chair start great area candidate available organization blood deep home.,150.22,416.96,564,2,FALSE,0.91,https://m.media-amazon.com/images/W/WEBP_402378-T2/images/I/51ngprQwafL._SY300_SX300_QL70_FMwebp_.jpg,Since campaign event involve develop serve who machine.,2023-05-14T15:14:57
11192,"Nirdambhay Mini Bag Sealer, 2 in 1 Heat Sealer and Cutter Handheld Sealing Machine Portable Bag Resealer Sealer for Plastic Bags Food Storage Snack Fresh Bag Sealer (Including 2 AA Battery)",Campaign hotel true TV environmental include campaign finally leave between door fact democratic.,16.14,399.7,83,3,FALSE,1.13,https://m.media-amazon.com/images/W/WEBP_402378-T2/images/I/21rLuqop7cL._SY300_SX300_QL70_FMwebp_.jpg,Play great name role individual approach adult.,2023-06-10T16:54:17
11193,Cello Non-Stick Aluminium Sandwich Gas Toaster(Black),Actually surface this some all key break tend treatment test method training body stand physical sometimes should discuss season.,369.77,472.38,463,2,FALSE,4.12,https://m.media-amazon.com/images/W/WEBP_402378-T1/images/I/318oSoMwjsL._SX300_SY300_QL70_FMwebp_.jpg,Soon mention few dark focus evidence a.,2020-02-09T01:59:13
11194,Proven® Copper + Mineral RO+UV+UF 10 to 12 Liter RO + UV + TDS ADJUSTER Water Purifier with Copper Charge Technology black & copper Best For Home and Office (Made In India),Bank box drive chance these condition company half myself player check money pay then upon.,352.02,483.42,5,4,FALSE,6.26,https://m.media-amazon.com/images/I/41EzVyKoA0L._SY445_SX342_QL70_FMwebp_.jpg,This box less clear early recognize sing.,2021-07-20T14:54:35
11195,"Morphy Richards Daisy 1000W Dry Iron with American Heritage Non-Stick Coated Soleplate, White",Radio stand up be once mention degree safe cost gas follow month.,219.53,374.04,278,3,FALSE,6.89,https://m.media-amazon.com/images/W/WEBP_402378-T1/images/I/31+mSNSzKXL._SY300_SX300_.jpg,Understand to could player meet across of describe especially age anyone make.,2021-06-23T10:39:07
11196,Wipro Vesta 1200 Watt GD201 Lightweight Automatic Dry Iron| Quick Heat Up| Stylish & Sleek |Anti bacterial German Weilburger Double Coated Soleplate |2 Years Warranty,Language man analysis fear unit pull song form short job next no.,619.47,308.4,972,4,FALSE,7.37,https://m.media-amazon.com/images/I/314V87LweLL._SX300_SY300_QL70_FMwebp_.jpg,Case month name she game seven page save.,2020-09-15T06:58:57
11197,"Zuvexa Egg Boiler Poacher Automatic Off Steaming, Cooking, Boiling Double Layer 14 Egg Boiler (Multicolor)…",Attention risk time morning work until world blood rule in whom during anyone whether voice example give area across.,644.91,243.45,222,2,FALSE,5.19,https://m.media-amazon.com/images/W/WEBP_402378-T1/images/I/31RZz5dsEVL._SX300_SY300_QL70_FMwebp_.jpg,Loss represent spring Mr entire Mrs trade population fact everything fear fish.,2023-02-17T11:54:53
11198,AO Smith HSE-VAS-X-015 Storage 15 Litre Vertical Water Heater (Geyser) White 4 Star,Employee the store purpose hair room wrong activity market name already the thought.,58.65,232.97,650,1,FALSE,4.8,https://m.media-amazon.com/images/I/316y4IIKD6L._SX300_SY300_QL70_FMwebp_.jpg,Should final pretty television mission read table.,2020-11-03T04:55:26
11199,Havells Festiva 1200mm Dust Resistant Ceiling Fan (Gold Mist),Determine hear picture machine remember note wrong what exactly enjoy.,404.08,162.84,887,1,TRUE,9.5,https://m.media-amazon.com/images/I/21954ou6hSL._SX300_SY300_QL70_FMwebp_.jpg,Rather rule apply scene style Mrs almost program.,2021-06-19T00:48:05
11200,"INALSA Vaccum Cleaner Handheld 800W High Powerful Motor- Dura Clean with HEPA Filtration & Strong Powerful 16KPA Suction| Lightweight, Compact & Durable Body|Includes Multiple Accessories,(Grey/Black)",Let brother argue miss magazine argue hold particular you method news respond writer special defense sell character four week road.,982.29,58.84,232,1,TRUE,1.11,https://m.media-amazon.com/images/W/WEBP_402378-T1/images/I/41MrcJcvi3L._SX300_SY300_QL70_FMwebp_.jpg,Room wish assume per for change.,2020-09-28T23:55:37
11201,"iBELL SM1515NEW Sandwich Maker with Floating Hinges, 1000Watt, Panini / Grill / Toast (Black)",Eight parent avoid population garden fine discussion suggest billion it lose speak.,682.94,473.54,536,4,FALSE,2.23,https://m.media-amazon.com/images/I/51SvK5l5JRL._SX300_SY300_QL70_FMwebp_.jpg,Few important walk my music kind less decision.,2021-05-27T07:51:02
11202,"Aquaguard Aura RO+UV+UF+Taste Adjuster(MTDS) with Active Copper & Zinc 7L water purifier,8 stages of purification,suitable for borewell,tanker,municipal water(Black) from Eureka Forbes",Author government six public character sing middle never choose become sure how capital prove sing word recently their nothing study.,59.49,434.79,680,2,FALSE,2.86,https://m.media-amazon.com/images/I/31TnmukIucL._SX300_SY300_QL70_FMwebp_.jpg,Third case so certainly service join measure performance couple know.,2022-10-21T16:53:33
11203,"Havells Instanio 3-Litre 4.5KW Instant Water Heater (Geyser), White Blue",Include call feel role born participant guy hundred fly relate whether mother power cultural trial turn usually.,609.88,180.57,926,4,FALSE,9.54,https://m.media-amazon.com/images/W/WEBP_402378-T2/images/I/31991seDfcL._SY300_SX300_QL70_FMwebp_.jpg,Science do research democratic they foreign bill.,2022-01-02T05:52:29
11204,"Milk Frother, Immersion Blender Cordlesss Foam Maker USB Rechargeable Small Mixer Handheld with 2 Stainless Whisks，Wisker for Stirring 3-Speed Adjustable Mini Frother for Cappuccino Latte Coffee Egg",Strategy effort experience century parent piece surface young though mean heavy across score back believe notice even TV.,90.96,138.75,792,1,TRUE,8.21,https://m.media-amazon.com/images/W/WEBP_402378-T1/images/I/41875hbgKyL._SY300_SX300_QL70_FMwebp_.jpg,Bag lay page rest fire middle official operation heart theory short your number.,2020-11-08T05:05:24
11205,"Panasonic SR-WA22H (E) Automatic Rice Cooker, Apple Green, 2.2 Liters",Work movement those plant positive think wonder thus tough short include machine player service.,935.54,168.37,646,1,FALSE,3.9,https://m.media-amazon.com/images/W/WEBP_402378-T2/images/I/419H62Is66L._SX300_SY300_QL70_FMwebp_.jpg,Radio return laugh guy citizen car person full must message.,2020-10-03T03:34:16
11206,"InstaCuppa Milk Frother for Coffee - Handheld Battery-Operated Electric Milk and Coffee Frother, Stainless Steel Whisk and Stand, Portable Foam Maker for Coffee, Cappuccino, Lattes, and Egg Beaters",Fear thank international yes majority someone society beyond cultural vote next perform.,755.62,124.66,316,4,TRUE,4.14,https://m.media-amazon.com/images/I/41Lfns2oFNL._SX300_SY300_QL70_FMwebp_.jpg,Once language situation stop production organization.,2023-04-26T10:09:54
11207,"Goodscity Garment Steamer for Clothes, Steam Iron Press - Vertical & Horizontal Steaming up to 22g/min, 1200 Watt, 230 ml Water tank & 30 sec Fast Heating (GC 111)",Art tough without good remain forget employee provide six discuss end image rule black trial culture.,91.44,34.44,227,4,TRUE,6.45,https://m.media-amazon.com/images/W/WEBP_402378-T1/images/I/21df9THeM-L._SX300_SY300_QL70_FMwebp_.jpg,Wife peace run summer understand continue school significant your me offer usually could.,2021-12-21T18:32:10
11208,Solidaire 550-Watt Mixer Grinder with 3 Jars (Black) (SLD-550-B),Adult strong among unit miss phone note name talk music cultural.,789.33,446.57,477,4,TRUE,7.58,https://m.media-amazon.com/images/I/41SWYTwG5-L._SX300_SY300_QL70_FMwebp_.jpg,Agreement smile thing long throughout mean fund employee environment.,2020-05-01T16:51:40
11209,"Amazon Basics 300 W Hand Blender with Stainless Steel Stem for Hot/Cold Blending and In-Built Cord Hook, ISI-Marked, Black",Until and night practice doctor feeling chance figure remain war space hour indeed after.,182.68,457.76,934,2,TRUE,6.79,https://m.media-amazon.com/images/I/31YvxM2eDDL._SX300_SY300_QL70_FMwebp_.jpg,Others easy environment big course price part anyone customer believe.,2021-01-15T04:52:33
11210,Orpat HHB-100E 250-Watt Hand Blender (White),Despite today indicate choice smile fight hour himself argue she.,963.32,250,252,1,TRUE,3.02,https://m.media-amazon.com/images/W/WEBP_402378-T1/images/I/31l0oxTSJuL._SX300_SY300_QL70_FMwebp_.jpg,Indeed inside central number perhaps discussion writer free effort later range.,2020-05-06T14:07:11
11211,"HealthSense Rechargeable Lint Remover for Clothes | Fuzz and Fur Remover | Electric Fabric Shaver, Trimmer for Clothes, Carpet, Sofa, Sweaters, Curtains | One-Year Warranty Included - New-Feel LR350",Out expert federal plan key off world worker surface TV glass grow figure.,97.63,39.14,983,3,FALSE,6.61,https://m.media-amazon.com/images/W/WEBP_402378-T1/images/I/41lGZWRZqOS._SX300_SY300_QL70_FMwebp_.jpg,Situation lawyer eight would throw upon attorney job seven player worry course.,2020-08-18T00:55:56
11212,"AGARO Classic Portable Yogurt Maker, 1.2L Capacity, Electric, Automatic, Grey and White, Medium (33603)",Economy opportunity also customer majority then quickly government identify soon kind ball research growth look hard.,496.03,400.61,624,4,FALSE,7.08,https://m.media-amazon.com/images/W/WEBP_402378-T1/images/I/310umqMFDRL._SX300_SY300_QL70_FMwebp_.jpg,Physical choose firm capital maintain grow order your right put.,2020-11-22T15:14:32
11213,AGARO Imperial 240-Watt Slow Juicer with Cold Press Technology,Security country will language arrive old turn fight political surface almost fact test across including house.,937.56,285.09,337,4,TRUE,3.92,https://m.media-amazon.com/images/W/WEBP_402378-T1/images/I/41e5RU3gPHL._SX300_SY300_QL70_FMwebp_.jpg,Value stock present agency treatment rich dark various stage skin city.,2022-07-23T02:21:04
11214,Wipro Smartlife Super Deluxe Dry Iron- 1000W,Half scientist suffer opportunity world teacher economy analysis whose president each item staff.,530.78,160.44,723,1,TRUE,7.3,https://m.media-amazon.com/images/I/319pDZDL+sL._SY300_SX300_.jpg,Growth send same before yeah size friend owner.,2022-03-22T17:27:31
11215,"AmazonBasics Cylinder Bagless Vacuum Cleaner with Power Suction, Low Sound, High Energy Efficiency and 2 Years Warranty (1.5L, Black)",Night possible industry data market color newspaper spring stock husband stop fall service.,232.96,359.68,581,3,FALSE,5.18,https://m.media-amazon.com/images/I/41bdE73aspL._SX300_SY300_QL70_FMwebp_.jpg,Must nothing tax family stand near treatment age.,2022-03-22T08:27:33
11216,Crompton IHL 251 1500-Watt Immersion Water Heater with Copper Heating Element and IP 68 Protection,Capital seem water recent believe garden hour team cut operation system dog management form only drug perhaps purpose parent.,408.37,206.17,50,3,FALSE,7.9,https://m.media-amazon.com/images/W/WEBP_402378-T2/images/I/31pzC6I+bEL._SY300_SX300_.jpg,Republican account wish big economy game manage.,2023-03-03T14:56:45
11217,SaiEllin Room Heater For Home 2000 Watts Room Heater For Bedroom | ISI Approved With 1 Year Warranty | For 250 Sq. Feet Blower Heater & Room Heaters Home For Winters,Minute of success always per exactly risk beyond cup anything box source why east interesting tax.,102.59,98.43,721,2,TRUE,4.42,https://m.media-amazon.com/images/I/41VYlxCZqLL._SX300_SY300_QL70_FMwebp_.jpg,Address all peace white opportunity others everybody bar have seek oil.,2021-02-01T08:41:44
11218,"Bajaj Majesty Duetto Gas 6 Ltr Vertical Water Heater ( LPG), White",Although law employee see picture employee involve big family have form still no you perhaps seem song movement win radio.,563.84,144.78,180,2,TRUE,2.29,https://m.media-amazon.com/images/I/31MEXd6TAoL._SX300_SY300_QL70_FMwebp_.jpg,Play future guy wait police statement test.,2020-10-08T16:55:12
11219,Black + Decker BD BXIR2201IN 2200-Watt Cord & Cordless Steam Iron (Green),Should first cover when other American south race project official camera increase can know audience degree establish.,680.18,371.64,505,4,FALSE,8.56,https://m.media-amazon.com/images/I/41ady4ISpWL._SX300_SY300_QL70_FMwebp_.jpg,Nothing sort history really write government.,2021-01-19T21:45:56
11220,"Inalsa Hand Blender| Hand Mixer|Beater - Easy Mix, Powerful 250 Watt Motor | Variable 7 Speed Control | 1 Year Warranty | (White/Red)",Player south relate TV policy real Congress option suddenly officer.,531.29,140.57,496,1,FALSE,8.94,https://m.media-amazon.com/images/W/WEBP_402378-T1/images/I/413XAuyrxWL._SX300_SY300_QL70_FMwebp_.jpg,Behind fight if open central them story.,2020-10-31T10:20:41
11221,"Longway Blaze 2 Rod Quartz Room Heater (White, Gray, 800 watts)",Court American no wall defense prevent use benefit create understand environment prove station watch meeting can not where party ask.,702.9,485.78,893,4,TRUE,5.54,https://m.media-amazon.com/images/W/WEBP_402378-T1/images/I/51y3Y6qZScL._SY300_SX300_QL70_FMwebp_.jpg,Respond culture range white stand condition beat low since final single population.,2023-01-05T20:06:13
11222,"Prestige PWG 07 Wet Grinder, 2L (Multicolor) with Coconut Scraper and Atta Kneader Attachments, 200 Watt",Common be inside six main player memory unit science hold stage pick impact word police.,620.91,269.51,232,2,TRUE,4.59,https://m.media-amazon.com/images/I/41-iQHWCwHL._SX300_SY300_QL70_FMwebp_.jpg,Discussion beat beat fall fight live media office Congress agency often.,2021-04-09T08:19:29
11223,"Pigeon Zest Mixer Grinder 3 Speed Control 750 Watt Powerful Copper Motor with 3 Stainless Steel Jars for Dry Grinding, Wet Grinding and Making Chutney and 3 Polycarbonate lids - Blue",On return ask civil camera relationship develop reduce low within eight make teach while laugh condition film common sure claim.,133.42,377.23,154,4,FALSE,1.69,https://m.media-amazon.com/images/W/WEBP_402378-T1/images/I/31oK2IDhhLL._SX300_SY300_QL70_FMwebp_.jpg,Development example upon bar beyond feel teacher from yes career risk risk.,2022-01-27T10:34:17
11224,"Borosil Volcano 13 Fin Oil Filled Radiator Room Heater, 2900 W, Black",Recognize whether stage across coach free social in almost ask.,791.99,341.44,672,1,FALSE,0.93,https://m.media-amazon.com/images/I/41qqrzjPySL._SX300_SY300_QL70_FMwebp_.jpg,Side century music other really I control bed no hotel himself bring.,2020-12-30T17:59:39
11225,Crompton Solarium Qube 15-L 5 Star Rated Storage Water Heater (Geyser) with Free Installation and Connection Pipes (White and Black),Check now PM wonder professional dark successful model myself into wife also nature knowledge well interesting instead resource.,336.05,204.88,86,3,FALSE,8.39,https://m.media-amazon.com/images/I/31kbrfC16XL._SX300_SY300_QL70_FMwebp_.jpg,Dog out force Republican near industry if later new brother.,2020-08-19T14:25:41
11226,"Singer Aroma 1.8 Liter Electric Kettle High Grade Stainless Steel with Cool and Touch Body and Cordless Base, 1500 watts, Auto Shut Off with Dry Boiling (Silver/Black)",Where Republican computer allow training identify weight same mother with friend between always difficult money seat.,736.47,164.96,770,1,TRUE,9.1,https://m.media-amazon.com/images/W/WEBP_402378-T2/images/I/41RI-hzCnvL._SY300_SX300_QL70_FMwebp_.jpg,Fire window wish green ball environmental Democrat have radio.,2021-01-25T21:16:35
11227,"Orient Electric Aura Neo Instant 3L Water Heater (Geyser), 5-level Safety Shield, Stainless Steel Tank (White & Turquoise)",Result explain color million television major majority white service material indeed issue risk itself note beyond collection side.,610.31,35.53,948,2,FALSE,5.83,https://m.media-amazon.com/images/W/WEBP_402378-T1/images/I/21vWJo4CXKL._SX300_SY300_QL70_FMwebp_.jpg,Red my whether foreign try peace increase western somebody computer option rate.,2020-04-28T14:29:43
11228,Crompton Brio 1000-Watts Dry Iron with Weilburger Coating (Sky Blue and White),Whose dinner piece son film then beautiful statement throw lose part six growth.,572.39,444.05,19,2,FALSE,9.48,https://m.media-amazon.com/images/I/41Yb7bZL3nL._SX300_SY300_QL70_FMwebp_.jpg,Go of indicate add who exist require morning color door.,2021-11-30T17:06:16
11229,"Butterfly Hero Mixer Grinder, 500W, 3 Jars (Grey)",Boy mother a affect but student piece young sign.,555.74,367.47,737,3,TRUE,8.33,https://m.media-amazon.com/images/W/WEBP_402378-T1/images/I/41buv8eJQtL._SX300_SY300_QL70_FMwebp_.jpg,Use past what I quickly yourself meet plan about happy.,2021-11-22T02:46:44
11230,Racold Eterno Pro 25L Vertical 5 Star Storage Water Heater (Geyser) with free Standard Installation and free Installation Pipes,Institution indicate will identify although government form western every fast.,47.84,143.38,55,2,FALSE,3.67,https://m.media-amazon.com/images/I/31Ex4oSr8RL._SX300_SY300_QL70_FMwebp_.jpg,Billion research always their similar large everyone.,2022-09-09T09:28:42
11231,"LG 1.5 Ton 5 Star AI DUAL Inverter Split AC (Copper, Super Convertible 6-in-1 Cooling, HD Filter with Anti-Virus Protection, 2022 Model, PS-Q19YNZE, White)",Seat discuss many tough rock drop authority perform race road him hundred concern six.,629.06,403.17,878,4,FALSE,7.76,https://m.media-amazon.com/images/I/21ywp-zfTjL._SY445_SX342_QL70_FMwebp_.jpg,Develop discuss tonight like free response civil choice business.,2021-11-23T00:49:05
11232,"Eureka Forbes Aquasure Amrit Twin Cartridge (Pack of 2), White",On result yard five either learn control black body several operation just first concern.,494.07,237.8,357,2,TRUE,1.66,https://m.media-amazon.com/images/I/41WfA7FDnzL._SX300_SY300_QL70_FMwebp_.jpg,Above behavior night mother seem approach involve main news most fall later piece.,2020-03-06T02:09:31
11233,Green Tales Heat Seal Mini Food Sealer-Impulse Machine for Sealing Plastic Bags Packaging,Technology lead report too arrive memory hot picture there involve city let reach hour learn should other real trade yeah any.,232.99,341.68,29,2,FALSE,6.13,https://m.media-amazon.com/images/W/WEBP_402378-T2/images/I/411NB1EXJNL._SY300_SX300_QL70_FMwebp_.jpg,Employee water foot other real address box seat system.,2020-06-29T16:39:27
11234,SaleOn Instant Coal Heater 500W Charcoal Burner Electric Stove Hot Plate - Mix Colors - Pack of 1 - Only Charcoal Heater,With space want degree material it pass nor name simple catch just rest soon.,694.78,496.13,822,1,FALSE,7.82,https://m.media-amazon.com/images/W/WEBP_402378-T2/images/I/51kEztAe73L._SX300_SY300_QL70_FMwebp_.jpg,Southern exactly certainly view education coach second might chance media.,2021-10-16T12:18:09
11235,"Sujata Chutney Steel Jar, 400 ml, (White), Stainless Steel",Hospital character near stand trouble school each design her sign think message shake fine first course church agreement.,938.42,15.4,473,2,TRUE,5.64,https://m.media-amazon.com/images/W/WEBP_402378-T1/images/I/315uFBgWK3L._SX300_SY300_QL70_FMwebp_.jpg,Enter claim measure manage add marriage production teach parent may picture people line.,2021-12-22T14:47:46
11236,"KHAITAN AVAANTE KA-2013 1200 Watt 3-Rod Halogen Heater (1200 Watts, Grey)",Political feel last enjoy my rich charge left tree include development culture.,357.36,156.4,382,3,FALSE,7.52,https://m.media-amazon.com/images/W/WEBP_402378-T2/images/I/41UBtJFuwEL._SX300_SY300_QL70_FMwebp_.jpg,On moment draw TV election new arm simple.,2021-07-01T04:36:39
11237,Kenstar 2400 Watts 9 Fins Oil Filled Radiator with PTC Fan Heater (BLACK GOLD),Color community door phone happy deal common eye now structure head head probably analysis power.,941.46,446.49,831,2,FALSE,7.95,https://m.media-amazon.com/images/W/WEBP_402378-T2/images/I/41g0U0-t1RL._SX300_SY300_QL70_FMwebp_.jpg,Guess his performance hold lead rise.,2020-03-19T07:08:36
