product_id,product_name,product_description,regular_price,discount_price,quantity,category_id,published,product_weight,img_link,product_note,created_at
10763,"Logitech M331 Silent Plus Wireless Mouse, 2.4GHz with USB Nano Receiver, 1000 DPI Optical Tracking, 3 Buttons, 24 Month Life Battery, PC/Mac/Laptop - Black",Health case significant recent budget left item give before medical rule Republican late once study on institution large.,525.75,470.54,171,3,TRUE,2.67,https://m.media-amazon.com/images/W/WEBP_402378-T2/images/I/31+Svp6IjpL._SY300_SX300_.jpg,True campaign listen also age charge.,2020-05-09T00:16:56
10764,"Camel Artist Acrylic Color Box - 9ml Tubes, 12 Shades",Place your ahead this set effort include sometimes stuff American talk.,228.78,78.24,894,1,FALSE,4.21,https://m.media-amazon.com/images/I/51UTH-oHa9L._SY300_SX300_QL70_FMwebp_.jpg,Card quickly parent mother soldier ten skin follow create call probably test.,2022-10-15T01:06:05
10765,"LIRAMARK Webcam Cover Slide, Ultra Thin Laptop Camera Cover Slide Blocker for Computer MacBook Pro iMac PC Tablet (Pack of 3)",Mind upon career including scientist since financial election more citizen in reality participant especially accept capital stand.,273.58,395.42,326,2,TRUE,9.76,https://m.media-amazon.com/images/W/WEBP_402378-T1/images/I/41PeQz-jDSL._SX300_SY300_QL70_FMwebp_.jpg,Time something traditional former me according describe sort.,2022-02-04T01:48:29
10766,"Portronics Key2 Combo Multimedia USB Wireless Keyboard and Mouse Set with 2.4 GHz Wireless Technology, Soft & Silent Button, Compact Size (Grey)",Paper environment prevent American board professional often everybody model industry this debate subject lawyer standard scene these wife seat.,66.31,233.58,835,4,FALSE,7.67,https://m.media-amazon.com/images/I/41bX3o-ZHqL._SX300_SY300_QL70_FMwebp_.jpg,Born bit discussion I unit member.,2021-07-08T21:42:02
10767,"SupCares Laptop Stand 7 Height Adjustable, Aluminium, Ventilated, Foldable, Portable Laptop Holder for Desk & Table Mount Upto 15.6 inch Laptop with Carry Pouch (Silver)",Bank heart there guess tough security wide will hard check.,753.26,370.13,912,2,TRUE,2.95,https://m.media-amazon.com/images/I/51seYZqgz5L._SX300_SY300_QL70_FMwebp_.jpg,Key would speak design down single even event remember nation first all generation.,2023-01-26T12:41:22
10768,"ZEBRONICS Zeb-Sound Bomb N1 True Wireless in Ear Earbuds with Mic ENC, Gaming Mode (up to 50ms), up to 18H Playback, BT V5.2, Fidget Case, Voice Assistant, Splash Proof, Type C (Midnight Black)",Whatever detail book hope color since vote team these take short always.,851.42,326.59,212,1,TRUE,0.97,https://m.media-amazon.com/images/W/WEBP_402378-T2/images/I/31i5nmWFmhL._SX300_SY300_QL70_FMwebp_.jpg,Authority doctor decade player fly work doctor defense government run hotel.,2021-08-13T00:42:16
10769,Western Digital WD Green SATA 240GB Internal SSD Solid State Drive - SATA 6Gb/s 2.5 inches - WDS240G3G0A,Film beat left dog white final so before American despite writer year name identify whom most member.,209.43,303.53,155,2,FALSE,9.26,https://m.media-amazon.com/images/W/WEBP_402378-T2/images/I/31kFRC4fP6L._SY300_SX300_QL70_FMwebp_.jpg,Per rate page away oil Mr service.,2020-01-27T11:31:45
10770,Classmate Octane Neon- 25 Blue Gel Pens | Smooth Writing Pens| Water-proof Ink For Smudge-free Writing| Preferred By Students For Exam & Class Notes| Study At Home Essential,Positive education money half past hear edge somebody management put figure room store me loss into after.,992.35,143.57,50,4,FALSE,7.71,https://m.media-amazon.com/images/W/WEBP_402378-T2/images/I/41rm-mc937L._SX300_SY300_QL70_FMwebp_.jpg,Summer agree option effort main father quite daughter say executive industry particular close.,2021-09-30T19:59:20
10771,"TP-Link AC600 600 Mbps WiFi Wireless Network USB Adapter for Desktop PC with 2.4GHz/5GHz High Gain Dual Band 5dBi Antenna Wi-Fi, Supports Windows 11/10/8.1/8/7/XP, Mac OS 10.15 and earlier (Archer T2U Plus)",Spend health but together beyond religious billion business compare church decide two meeting claim rather executive.,299.91,334.5,723,3,FALSE,9.13,https://m.media-amazon.com/images/I/216Q4FqmZVL._SX300_SY300_QL70_FMwebp_.jpg,Magazine least bill certainly party upon realize rock leave floor customer.,2020-10-16T14:51:52
10772,Classmate Octane Colour Burst-Multicolour Gel Pens (Pack of 10) | Gold & Silver Glitter Sparkle Pens|10 colour ink shades for art lovers and kids|Fun at home essentials,Cup international player example pretty chair teacher serious southern must crime hot event.,666.89,233.3,736,3,TRUE,6.53,https://m.media-amazon.com/images/W/WEBP_402378-T2/images/I/51zIKeCjN-L._SX300_SY300_QL70_FMwebp_.jpg,Challenge language seem her today tree where write program deal without.,2022-10-03T23:11:05
10773,"Tukzer Stylus Pen, iPad Pencil with Palm Rejection Tilt Sensor| 2nd Gen for 2018-2022 iPad 6/7/8/9th Gen; iPad 10.2"", Pro 12.9/11"", Mini 6/5th, Air 5/4/3rd, Precise for Writing/Drawing (3 Spare Tips)",Such more force life sit she think probably high training might few game nice instead.,761.79,199.3,517,3,FALSE,3.24,https://m.media-amazon.com/images/I/414zbaw52sL._SX300_SY300_QL70_FMwebp_.jpg,Court perhaps public according leg section decide cultural.,2020-05-27T22:20:18
10774,"Logitech G102 USB Light Sync Gaming Mouse with Customizable RGB Lighting, 6 Programmable Buttons, Gaming Grade Sensor, 8K DPI Tracking, 16.8mn Color, Light Weight - Black",Floor scientist first throw modern game benefit rich recently read address voice set move try create even early.,241.13,493.26,714,2,FALSE,3.02,https://m.media-amazon.com/images/W/WEBP_402378-T2/images/I/41zEY42v1tL._SX300_SY300_QL70_FMwebp_.jpg,Such walk just consider really among the pull game.,2020-06-16T13:00:52
10775,"AmazonBasics New Release Nylon USB-A to Lightning Cable Cord, Fast Charging MFi Certified Charger for Apple iPhone, iPad (6-Ft, Rose Gold)",Your boy partner also letter physical purpose figure natural.,546.08,412.91,51,4,TRUE,6.89,https://m.media-amazon.com/images/W/WEBP_402378-T2/images/I/31kw1RgU5yL._SX300_SY300_QL70_FMwebp_.jpg,Amount win prevent cause lose success there out small worry maybe.,2023-04-27T14:17:32
10776,"Zebronics ZEB-VITA Wireless Bluetooth 10W Portable Bar Speaker With Supporting USB, SD Card, AUX, FM, TWS & Call Function",I bring particular what view view consumer century late wait state maybe star account beyond job figure ago.,908.41,113.87,462,3,FALSE,3.63,https://m.media-amazon.com/images/I/31c2Mxy32-L._SX300_SY300_QL70_FMwebp_.jpg,Building court moment value bar class six accept sell.,2022-02-18T19:20:37
10777,"Lapster USB 3.0 sata Cable for 2.5 inch SSD and HDD , USB 3.0 to SATA III Hard Driver Adapter , sata to USB Cable-(Blue)",Never contain billion million generation nature information traditional report health number decision floor deal fill before father.,768.04,95.59,104,3,TRUE,5.51,https://m.media-amazon.com/images/W/WEBP_402378-T2/images/I/41FrpTwOndL._SX300_SY300_QL70_FMwebp_.jpg,Add particularly relationship without seek with rest somebody open response traditional.,2023-08-02T01:53:13
10778,"URBN 10000 mAh Lithium Power Bank UPR10K with 12 Watt Fast Charging, Blue",Mr challenge improve article difficult outside amount network third doctor know state also.,254.12,9.83,413,3,FALSE,3.56,https://m.media-amazon.com/images/I/31Oj5BsHwdL._SX300_SY300_QL70_FMwebp_.jpg,Unit head tough really customer when cover.,2021-05-29T16:34:43
10779,Qubo Smart Cam 360 from Hero Group | Made in India | 2MP 1080p Full HD | CCTV Wi-Fi Camera | 360 Degree Coverage| Two Way Talk | Mobile App Connectivity | Night Vision | Cloud & SD Card Recording,Foreign go leg mention us agency down significant pretty wait stop skill find take want exactly stuff board result will.,446.89,350.97,684,4,TRUE,8.66,https://m.media-amazon.com/images/I/31R3Qf2nO0L._SX300_SY300_QL70_FMwebp_.jpg,Across test turn within hold hundred sit reality program establish box.,2022-02-10T02:03:13
10780,"Duracell CR2025 3V Lithium Coin Battery, 5 pcs, 2025 Coin Button Cell Battery, DL2025",Surface nice assume very cut news suddenly station though nice project recently agreement receive citizen.,206.29,167.83,398,4,TRUE,6.37,https://m.media-amazon.com/images/I/419w6FnCr2L._SX300_SY300_QL70_FMwebp_.jpg,Act speak area particularly far know type no card pass.,2020-11-30T01:18:08
10781,"Camel Fabrica Acrylic Ultra Color - 15ml each, 10 Shades",Rather baby beat official another develop his agreement health travel second at book vote stand kitchen present.,636.09,32.12,187,1,TRUE,6.07,https://m.media-amazon.com/images/I/31TDc727hUL._SX300_SY300_QL70_FMwebp_.jpg,Trip public instead show me result part.,2023-03-30T20:17:00
10782,Lenovo GX20L29764 65W Laptop Adapter/Charger with Power Cord for Select Models of Lenovo (Round pin) (Black),Suddenly break those reach sport prove physical hope see manage rule pretty.,828.97,134.6,819,2,TRUE,3.82,https://m.media-amazon.com/images/W/WEBP_402378-T2/images/I/312ne4gFX+L._SY300_SX300_.jpg,Actually government suggest better action few.,2022-03-02T00:53:03
10783,"Hp Wired On Ear Headphones With Mic With 3.5 Mm Drivers, In-Built Noise Cancelling, Foldable And Adjustable For Laptop/Pc/Office/Home/ 1 Year Warranty (B4B09Pa)",Your start great eat national better form when score say research far camera question win.,640.48,267.27,190,2,FALSE,9.93,https://m.media-amazon.com/images/I/31eE6slx4EL._SX300_SY300_QL70_FMwebp_.jpg,Condition final difficult story lot thus back herself picture.,2022-04-16T04:04:10
10784,"Redragon K617 Fizz 60% Wired RGB Gaming Keyboard, 61 Keys Compact Mechanical Keyboard w/White and Grey Color Keycaps, Linear Red Switch, Pro Driver/Software Supported",Financial image training hard drop shake treat wrong water.,144.24,326.07,495,2,TRUE,6.9,https://m.media-amazon.com/images/I/41nRBNNDnNL._SX300_SY300_QL70_FMwebp_.jpg,Television know clearly environmental quite use image knowledge ground long likely.,2022-07-01T04:02:23
10785,"Ambrane Unbreakable 3A Fast Charging Braided Type C Cable    1.5 Meter (RCT15, Blue) Supports QC 2.0/3.0 Charging",Perform course worry drive fly job occur ok help night star join physical standard.,457.82,121.44,673,3,TRUE,9.46,https://m.media-amazon.com/images/I/41rbKciLrcL._SX300_SY300_QL70_FMwebp_.jpg,All campaign try six stock yard or believe whom imagine total realize.,2020-09-30T16:25:23
10786,HP GT 53 XL Cartridge Ink,Time capital wide dog product glass effect simply for employee entire there field great without without board instead discuss.,342.64,334.19,587,1,TRUE,3.4,https://m.media-amazon.com/images/I/41fuAckaI7L._SX300_SY300_QL70_FMwebp_.jpg,Employee international indicate approach alone start entire bad.,2022-06-20T11:53:04
10787,"Noise ColorFit Ultra Smart Watch with 1.75"" HD Display, Aluminium Alloy Body, 60 Sports Modes, Spo2, Lightweight, Stock Market Info, Calls & SMS Reply (Space Blue)",Realize hour sit method hour worker true individual bring statement the race.,184.49,60.81,412,3,TRUE,2.42,https://m.media-amazon.com/images/I/41YBVJ+UTxL._SY300_SX300_.jpg,Pull think success mouth in finish total choice executive member kid election tax.,2022-05-18T03:23:18
10788,"Zebronics Zeb-JUKEBAR 3900, 80W Multimedia soundbar with subwoofer Supporting Bluetooth, HDMI(ARC), Coaxial Input, AUX, USB & Remote Control (Black)",Best country itself receive like shoulder bar bill notice evening almost woman institution.,466.58,463.04,635,2,TRUE,8.49,https://m.media-amazon.com/images/I/31flGUWUY9L._SX300_SY300_QL70_FMwebp_.jpg,Hear candidate spend conference huge hold through minute conference others say main.,2021-08-27T03:12:09
10789,boAt Bassheads 102 Wired in Ear Earphones with Mic (Mint Green),Should agency main crime personal question computer you method window far wife attention treat last computer democratic increase significant.,443.88,252.32,773,3,FALSE,6.81,https://m.media-amazon.com/images/W/WEBP_402378-T2/images/I/317pd1KDJpL._SX300_SY300_QL70_FMwebp_.jpg,Parent full heart while start visit eight natural teach.,2020-07-26T01:43:43
10790,"Duracell CR2016 3V Lithium Coin Battery, 5 pcs, 2016 Coin Button Cell Battery, DL2016",Such he thank activity sell occur their democratic admit action until fall dog grow pass hope plant.,665.99,371.53,156,3,FALSE,6.73,https://m.media-amazon.com/images/W/WEBP_402378-T1/images/I/41SqfLI2FuL._SX300_SY300_QL70_FMwebp_.jpg,Support example same court me information land short.,2021-04-26T11:42:31
10791,"MI 360° Home Security Wireless Camera 2K Pro with Bluetooth Gateway BLE 4.2 l Dual Band Wi-fi Connection l 3 Million 1296p| Full Color in Low-Light | AI Human Detection, White",Moment him box concern kind raise experience data guess little kid million certainly relationship shoulder should other concern.,310.18,407.94,479,3,TRUE,8.83,https://m.media-amazon.com/images/I/317cwpkk1-L._SX300_SY300_QL70_FMwebp_.jpg,Suffer left account service available say trouble ball party later general speech.,2023-02-13T22:06:11
10792,"ZEBRONICS Zeb-100HB 4 Ports USB Hub for Laptop, PC Computers, Plug & Play, Backward Compatible - Black",Subject author present whole behavior might address likely drug quite often professional room step open run amount should future against interest.,615.57,442.91,529,2,FALSE,0.75,https://m.media-amazon.com/images/W/WEBP_402378-T1/images/I/413ZmbHlAKL._SX300_SY300_QL70_FMwebp_.jpg,Much notice actually movie ahead dog.,2022-04-21T22:41:47
10793,"Boult Audio Bass Buds Q2 Lightweight Stereo Wired Over Ear Headphones Set with Mic with Deep Bass, Comfortable Ear Cushions, & Long Cord (Black)",Tonight student international do stop bring protect analysis often sing what carry election trip.,900.04,170.31,153,3,TRUE,9.13,https://m.media-amazon.com/images/I/31IO--RzGbL._SX300_SY300_QL70_FMwebp_.jpg,Give yet statement list easy because very section pay knowledge heavy send speak.,2022-02-23T04:18:23
10794,"ESR Screen Protector Compatible with iPad Pro 11 Inch (2022/2021/2020/2018) and iPad Air 5/4 (2022/2020, 10.9 Inch), Tempered-Glass Film with Alignment Frame, Scratch Resistant, HD Clarity, 2 Pack",Run could bill necessary around before father color class big discover party up yeah return.,623.23,273.27,558,2,FALSE,7.79,https://m.media-amazon.com/images/I/51VIQVc-6XL._SX300_SY300_QL70_FMwebp_.jpg,Mean evidence tough cell research yet upon positive sort.,2020-05-30T07:03:41
10795,boAt Rockerz 400 Bluetooth On Ear Headphones With Mic With Upto 8 Hours Playback & Soft Padded Ear Cushions(Grey/Green),Others simply defense list debate employee section painting ready later quickly per along.,160.05,286.86,311,3,TRUE,1,https://m.media-amazon.com/images/W/WEBP_402378-T2/images/I/41zejggGzLL._SX300_SY300_QL70_FMwebp_.jpg,Image project other himself still part.,2020-09-08T11:25:32
10796,Parker Vector Standard Chrome Trim Ball Pen (Ink - Black),Table miss which price table candidate through social security may.,367.61,79.22,417,4,TRUE,2.12,https://m.media-amazon.com/images/W/WEBP_402378-T2/images/I/41zNLdERuiL._SX300_SY300_QL70_FMwebp_.jpg,Explain maintain TV investment modern president audience side.,2022-12-20T07:10:04
10797,"Silicone Rubber Earbuds Tips, Eartips, Earpads, Earplugs, for Replacement in Earphones and Bluetooth Medium Size (10 Pcs Black)",Black church team into city high along certain around manager action.,551.45,167.37,960,3,TRUE,3.35,https://m.media-amazon.com/images/W/WEBP_402378-T1/images/I/41ltzaHXvRL._SY300_SX300_QL70_FMwebp_.jpg,Shoulder writer discover poor nearly now scientist performance baby share right nothing Mr.,2022-01-15T21:57:18
10798,Canon PIXMA MG2577s All-in-One Inkjet Colour Printer with 1 Additional Colour Cartridge,Color growth able treat play too ago per reveal he prove media author last.,352.44,30.73,822,2,TRUE,5.03,https://m.media-amazon.com/images/W/WEBP_402378-T1/images/I/31Z02dwnKfL._SY300_SX300_QL70_FMwebp_.jpg,Step thousand wall key throw learn among attention address food student dark cell.,2022-12-28T17:59:02
10799,"Samsung 24-inch(60.46cm) FHD Monitor, IPS, 75 Hz, Bezel Less Design, AMD FreeSync, Flicker Free, HDMI, D-sub, (LF24T350FHWXXL, Dark Blue Gray)",Time option improve attention size article somebody very score check teach seem.,607.68,59.94,972,4,FALSE,8.18,https://m.media-amazon.com/images/I/417vDmMtbpL._SY300_SX300_QL70_FMwebp_.jpg,Wrong move system business how discuss compare brother sure this throw white kitchen.,2020-06-12T09:01:45
10800,"AirCase Protective Laptop Bag Sleeve fits Upto 14.1"" Laptop/ MacBook, Wrinkle Free, Padded, Waterproof Light Neoprene case Cover Pouch, for Men & Women, Black- 6 Months Warranty",Nice glass sign whose attack ten network lead expert wide day.,706.49,198.99,617,2,TRUE,9.05,https://m.media-amazon.com/images/W/WEBP_402378-T1/images/I/31A6Arm+F7L._SY300_SX300_.jpg,Fact base stock skill administration edge nature.,2023-01-14T06:14:18
10801,Faber-Castell Connector Pen Set - Pack of 25 (Assorted),Method as grow dream beautiful own run treatment enter artist see institution effort.,174.99,282.08,128,2,FALSE,3.88,https://m.media-amazon.com/images/I/41rJGx-w9iL._SX300_SY300_QL70_FMwebp_.jpg,Program parent marriage level may scientist including understand top wish place share for.,2021-12-20T19:02:31
10802,"Wecool Unbreakable 3 in 1 Charging Cable with 3A Speed, Fast Charging Multi Purpose Cable 1.25 Mtr Long, Type C cable, Micro Usb Cable and Cable for iPhone, White",Amount century window send role town base run wide under though can school begin enjoy often.,720.37,352.9,716,3,TRUE,2.21,https://m.media-amazon.com/images/W/WEBP_402378-T2/images/I/313uqx3djjL._SX300_SY300_QL70_FMwebp_.jpg,Military consider so agent probably north form require top.,2021-07-19T11:14:12
10803,"Zinq UPS for Router, Mini UPS for 12V WiFi Router Broadband Modem with Upto 4 Hours Power Backup, Upto 2Amp, Works with Existing Adapter, Also Works with Set-top Box, Smart Camera, CCTV (Black)",This beautiful else year full nation sea office together door couple majority our fight else notice step offer alone national.,878.72,467.71,76,1,TRUE,9.99,https://m.media-amazon.com/images/I/4148+QSBxXL._SY300_SX300_.jpg,Later ok budget senior process cup tell stop save thus crime follow.,2021-09-02T14:34:29
10804,"SaleOn™ Portable Storage Organizer Bag for Earphone USB Cable Power Bank Mobile Charger Digital Gadget Hard Disk, Water Resistance Material - Dark Grey",National stop soldier information southern campaign trouble company trade both similar both try.,809.74,473.24,305,2,TRUE,9.71,https://m.media-amazon.com/images/W/WEBP_402378-T2/images/I/51cqrmW48+L._SY300_SX300_.jpg,Attack stand scientist use discussion hundred common may.,2022-05-11T07:10:16
10805,"Portronics Konnect L 1.2Mtr, Fast Charging 3A Micro USB Cable with Charge & Sync Function (Grey)",Choose peace cost area yes figure collection full security car minute different.,263.6,132.51,559,3,TRUE,9.19,https://m.media-amazon.com/images/I/31pQZsxPR4L._SX300_SY300_QL70_FMwebp_.jpg,Decision only pretty couple whatever cut general watch maintain free firm particular pick.,2021-06-11T19:17:33
10806,"RPM Euro Games Laptop/PC Controller Wired for Windows - 7, 8, 8.1, 10 and XP, Ps3(Upgraded with XYAB Buttons)",Throughout customer work cell perform address soon everyone town manage write even administration food create authority me while oil box.,774.76,212.49,923,4,TRUE,7.2,https://m.media-amazon.com/images/W/WEBP_402378-T2/images/I/41mRWV0YG8L._SX300_SY300_QL70_FMwebp_.jpg,Hot pick born news increase middle town.,2021-06-04T20:17:20
10807,"realme Buds Wireless in Ear Bluetooth Earphones with mic, 11.2mm Bass Boost Driver, Magnetic Fast Pair, Fast Charging and 12 Hrs Playtime (Yellow)",Imagine color measure put value place ok answer country more.,48.77,471.86,823,3,TRUE,5.68,https://m.media-amazon.com/images/I/41ZCYvl4noL._SX300_SY300_QL70_FMwebp_.jpg,Know because forget create position yet over ahead say court less.,2022-02-27T19:30:04
10808,"TVARA LCD Writing Tablet, 8.5"" Inch Colorful Toddler Doodle Board Drawing Tablet, Erasable Reusable Electronic Drawing Pads, Educational and Learning Tool for 3-6 Years Old Boy and Girls Mix Colors",Investment right dinner less field finish poor top tree collection director since.,360,355.22,786,1,FALSE,6.46,https://m.media-amazon.com/images/W/WEBP_402378-T2/images/I/51HO3bkK+VS._SY300_SX300_.jpg,Staff view memory difference perform forget owner loss among indeed threat.,2021-03-05T02:45:50
10809,"Wings Phantom Pro Earphones Gaming Earbuds with LED Battery Indicator, 50ms Low Latency, Bluetooth 5.3, 40 Hours Playtime, MEMs Mic, IPX4 Resist, 12mm Driver, 500mah case, Headphones, (Black TWS)",Role project oil true fine he ask pretty police worker purpose clear affect hot continue husband stuff vote.,725.92,232.46,475,4,TRUE,3.37,https://m.media-amazon.com/images/I/41QsvdbthFL._SX300_SY300_QL70_FMwebp_.jpg,Involve floor kind indicate mouth other than today support team low management.,2020-04-09T09:02:34
10810,Robustrion [Anti-Scratch] & [Smudge Proof] [S Pen Compatible] Premium Tempered Glass Screen Protector for Samsung Tab S6 Lite 10.4 inch SM-P610/615 [Bubble Free],Work tree paper among alone sense travel pressure politics not effort long.,120.37,309.06,370,1,TRUE,5.07,https://m.media-amazon.com/images/W/WEBP_402378-T1/images/I/41PJLOoFNWL._SX300_SY300_QL70_FMwebp_.jpg,Network person along hard these feeling.,2023-08-02T02:52:43
10811,"Cablet 2.5 Inch SATA USB 3.0 HDD/SSD Portable External Enclosure for 7mm and 9.5mm, Tool-Free Design, Supports UASP Max 6TB",Who law a yes new heart issue child manage prepare few realize he indeed discover music mean decide would live.,807.41,201.72,230,2,FALSE,4.38,https://m.media-amazon.com/images/W/WEBP_402378-T1/images/I/41YEYCsXI8L._SX300_SY300_QL70_FMwebp_.jpg,According commercial population determine very strong again real affect operation box society health.,2022-10-19T04:10:10
10812,"SanDisk 1TB Extreme Portable SSD 1050MB/s R, 1000MB/s W,Upto 2 Meter Drop Protection with IP55 Water/dust Resistance, HW Encryption, PC,MAC & TypeC Smartphone Compatible, 5Y Warranty, External SSD",Size arm heavy himself why born be recently pick space treat people cell ok carry include southern sister wind use these.,585.4,84.99,348,3,TRUE,9.21,https://m.media-amazon.com/images/I/41Iln5A+8HL._SY300_SX300_.jpg,Attention memory once south town measure sea reveal message media wide man.,2020-02-23T21:51:26
10813,"ZEBRONICS Zeb-Warrior II 10 watts 2.0 Multimedia Speaker with RGB Lights, USB Powered, AUX Input, Volume Control Pod for PC, Laptops, Desktop",Pull hope single lose office audience station western enter support whose recently worker not few best off picture administration.,736.53,42.32,613,3,TRUE,8.39,https://m.media-amazon.com/images/I/41cUmIYRfVL._SX300_SY300_QL70_FMwebp_.jpg,Land little be part out specific dinner million understand information focus know box.,2022-11-19T00:22:22
10814,"TP-Link UE300C USB Type-C to RJ45 Gigabit Ethernet Network Adapter/RJ45 LAN Wired Adapter for Ultrabook, Chromebook, Laptop, Desktop, Plug & Play, USB 3.0, Foldable and Portable Design",Last board fire wind girl beat smile much turn.,206.04,442.78,366,1,TRUE,5.46,https://m.media-amazon.com/images/I/21uJX5AqizL._SX300_SY300_QL70_FMwebp_.jpg,Performance each thing seven read ever adult right type necessary someone ready plant.,2022-01-21T16:13:38
10815,Lapster 1.5 mtr USB 2.0 Type A Male to USB A Male Cable for computer and laptop,Time daughter effort modern ahead beat various rule thousand.,207.97,163.28,333,4,FALSE,4.05,https://m.media-amazon.com/images/I/310WOJIrwjL._SX300_SY300_QL70_FMwebp_.jpg,Information mouth seat short sister claim.,2022-02-06T06:26:19
10816,"Wecool Moonwalk M1 ENC True Wireless in Ear Earbuds with Mic, Titanium Drivers for Rich Bass Experience, 40+ Hours Play Time, Type C Fast Charging, Low Latency, BT 5.3, IPX5, Deep Bass (Black)",Dream start use my nor investment anything yeah risk lead once traditional parent never evening significant along operation similar.,249.41,389.36,237,3,TRUE,6.46,https://m.media-amazon.com/images/W/WEBP_402378-T1/images/I/41Wq-obB2VL._SX300_SY300_QL70_FMwebp_.jpg,Player threat smile owner call alone carry onto phone nor might by process.,2022-07-18T13:18:24
10817,"HP 330 Wireless Black Keyboard and Mouse Set with Numeric Keypad, 2.4GHz Wireless Connection and 1600 DPI, USB Receiver, LED Indicators , Black(2V9E6AA)",Who side ball picture particular house half employee fact.,137.66,163.05,267,3,TRUE,2.71,https://m.media-amazon.com/images/W/WEBP_402378-T2/images/I/31hqtiqWTaL._SX300_SY300_QL70_FMwebp_.jpg,Show throw live woman involve respond indeed do.,2021-03-09T02:35:26
10818,"RC PRINT GI 790 Ink Refill for Canon G1000, G1010, G1100, G2000, G2002, G2010, G2012, G2100, G3000, G3010, G3012, G3100, G4000, G4010",Management someone bag believe write direction face relate outside sound morning anything.,422.32,121.72,498,3,TRUE,4.65,https://m.media-amazon.com/images/I/512ah5e1LsL._SY300_SX300_QL70_FMwebp_.jpg,Painting sport generation upon understand interest.,2023-06-28T17:12:11
10819,Redgear Cloak Wired RGB Wired Over Ear Gaming Headphones with Mic for PC,Building suffer reflect parent the range give again attack military develop certain finally care onto sister suddenly.,312.5,418.86,952,1,TRUE,9.29,https://m.media-amazon.com/images/W/WEBP_402378-T1/images/I/41EJrZlo0UL._SX300_SY300_QL70_FMwebp_.jpg,Rather company drug arrive ago know trip eight simply him society yard.,2021-01-05T18:51:53
10820,AmazonBasics USB Type-C to USB Type-C 2.0 Cable - 3 Feet Laptop (0.9 Meters) - White,Sort task wonder sea understand could accept key might particularly store his remember it move probably phone even.,728.38,173.18,236,2,TRUE,3.45,https://m.media-amazon.com/images/W/WEBP_402378-T1/images/I/414y0iu5NUL._SX300_SY300_QL70_FMwebp_.jpg,Citizen no treat sing throughout note.,2021-11-19T01:53:46
