product_id,product_name,product_description,regular_price,discount_price,quantity,category_id,published,product_weight,img_link,product_note,created_at
10354,"Tecno Spark 9 (Sky Mirror, 6GB RAM,128GB Storage) | 11GB Expandable RAM | Helio G37 Gaming Processor",Memory range eye human skill environmental voice different specific moment that day father specific effort on step watch billion.,129.87,469.07,680,1,FALSE,3.72,https://m.media-amazon.com/images/I/41PNVbmQdfL._SX300_SY300_QL70_ML2_.jpg,Finally third role himself present arm recently.,2020-07-31T04:45:40
10355,Flix Micro Usb Cable For Smartphone (Black),Laugh structure rise marriage from rest hundred most sound deep lay night.,669.88,108.98,290,1,FALSE,3.33,https://m.media-amazon.com/images/I/31qGpf8uzuL._SY445_SX342_QL70_ML2_.jpg,Prepare collection town campaign save guess blue including daughter.,2020-01-14T00:41:44
10356,"JBL C100SI Wired In Ear Headphones with Mic, JBL Pure Bass Sound, One Button Multi-function Remote, Premium Metallic Finish, Angled Buds for Comfort fit (Red)",Attorney however certain she street like including friend when dream hotel unit.,294.11,320.43,275,4,TRUE,5.8,https://m.media-amazon.com/images/I/31kLQHU5pdL._SX300_SY300_QL70_ML2_.jpg,Civil project Republican bring partner front discussion region.,2023-04-09T13:48:52
10357,"Tukzer Capacitive Stylus Pen for Touch Screens Devices, Fine Point, Lightweight Metal Body with Magnetism Cover Cap for Smartphones/Tablets/iPad/iPad Pro/iPhone (Grey)",Right nothing boy as summer computer sport identify section investment compare job baby sure eye.,90.87,465.26,10,2,TRUE,6.69,https://m.media-amazon.com/images/I/31bKIZtFGWL._SX300_SY300_QL70_ML2_.jpg,Small hit box walk return fish leg station mind our though miss rate.,2023-07-04T09:14:42
10358,"Samsung Galaxy M13 5G (Aqua Green, 6GB, 128GB Storage) | 5000mAh Battery | Upto 12GB RAM with RAM Plus",Make effort how provide responsibility television office listen art deep structure mouth hotel never.,269.02,114.37,369,4,FALSE,1.96,https://m.media-amazon.com/images/I/413sCRKobNL._SX300_SY300_QL70_ML2_.jpg,Fast hair entire Democrat condition would.,2023-07-02T02:02:58
10359,"Tukzer Capacitive Stylus Pen for Touch Screens Devices, Fine Point, Lightweight Metal Body with Magnetism Cover Cap for Smartphones/Tablets/iPad/iPad Pro/iPhone (White)",Year our week challenge old that ahead many suggest land type technology bad PM present fall piece through too.,909.18,68.64,401,4,FALSE,6.8,https://m.media-amazon.com/images/I/3187gPkT6GL._SX300_SY300_QL70_ML2_.jpg,Key end many red participant through rock people.,2022-06-09T15:25:29
10360,Mi 10W Wall Charger for Mobile Phones with Micro USB Cable (Black),Election sound human discover protect next go station tree home picture thing approach lot indeed base thing foreign water above.,208.22,204.97,63,2,FALSE,2.42,https://m.media-amazon.com/images/I/31H8AoDYAYL._SX300_SY300_QL70_ML2_.jpg,Hear change character dog her dream decade across nor spring leader kind.,2022-09-07T10:35:26
10361,"Fire-Boltt India's No 1 Smartwatch Brand Talk 2 Bluetooth Calling Smartwatch with Dual Button, Hands On Voice Assistance, 60 Sports Modes, in Built Mic & Speaker with IP68 Rating",Never international industry apply would region be next blue pretty argue pass whose interesting much success part business available.,996.89,251.68,168,4,TRUE,6.09,https://m.media-amazon.com/images/I/41vMaBVWDjL._SX300_SY300_QL70_ML2_.jpg,Him father girl wrong left he firm.,2021-03-01T09:00:30
10362,"STRIFF 12 Pieces Highly Flexible Silicone Micro USB Protector, Mouse Cable Protector, Suit for All Cell Phones, Computers and Chargers (White)",Give throughout same small voice mother writer whose mother indeed.,566.92,157.85,700,3,FALSE,1.9,https://m.media-amazon.com/images/I/31SKRsp7Y1L._SX300_SY300_QL70_ML2_.jpg,Game police character let weight green reveal morning.,2020-02-28T09:46:50
10363,"FLiX (Beetel) USB to Type C PVC Data Sync & 2A Smartphone Fast Charging Cable, Made in India, 480Mbps Data Sync, Tough Cable, 1 Meter Long USB Cable for USB Type C Devices Black XCD-C12",Thus start require trouble student although page more game can economic.,220.63,407.72,838,2,TRUE,1.11,https://m.media-amazon.com/images/I/31tWzHMz6vL._SY445_SX342_QL70_ML2_.jpg,Middle true grow case sing set political nor office probably newspaper goal.,2023-02-10T09:20:56
10364,"Noise ColorFit Pro 4 Alpha Bluetooth Calling Smart Watch with 1.78 AMOLED Display, Tru Sync, 60hz Refresh Rate, instacharge, Gesture Control, Functional 360 Digital Crown (Jet Black)",Condition for economy team window use wear campaign plant.,238.51,84.77,958,2,FALSE,9.86,https://m.media-amazon.com/images/I/4123OnLZCFL._SX300_SY300_QL70_ML2_.jpg,Song front hope cost develop cultural.,2020-05-16T18:15:33
10365,Elv Mobile Phone Mount Tabletop Holder for Phones and Tablets - Black,Game civil say catch movie clear on pull notice wrong southern.,427.26,363.67,631,4,TRUE,5.23,https://m.media-amazon.com/images/I/318Pgjl1wqL._SX300_SY300_QL70_ML2_.jpg,Imagine method establish feeling example focus.,2023-03-21T00:31:53
10366,"iQOO Z6 44W by vivo (Raven Black, 6GB RAM, 128GB Storage) | 6.44"" FHD+ AMOLED Display | 50% Charge in just 27 mins | in-Display Fingerprint Scanning",Rule agree make hair imagine wind current under citizen table security.,887.08,54.07,623,3,TRUE,8.22,https://m.media-amazon.com/images/I/41Lif4YWC2L._SX300_SY300_QL70_ML2_.jpg,Let produce task win voice art movement never article light war.,2022-10-08T23:16:31
10367,"Redmi 11 Prime 5G (Meadow Green, 4GB RAM 64GB ROM) | Prime Design | MTK Dimensity 700 | 50 MP Dual Cam | 5000mAh | 7 Band 5G",View day century check available family identify social break prevent study right whose collection give full stand indicate answer.,260.93,272.58,782,4,TRUE,0.63,https://m.media-amazon.com/images/I/41gQbaGlXrL._SX300_SY300_QL70_ML2_.jpg,Who against similar ask price focus often no suffer.,2020-08-06T18:59:25
10368,"Noise Pulse Buzz 1.69"" Bluetooth Calling Smart Watch with Call Function, 150 Watch Faces, 60 Sports Modes, Spo2 & Heart Rate Monitoring, Calling Smart Watch for Men & Women - Rose Pink",Important especially realize blood bar health heavy will specific mean later TV station family special capital.,436.86,476.87,568,2,TRUE,9.94,https://m.media-amazon.com/images/I/41lf0N5STAL._SX300_SY300_QL70_ML2_.jpg,Service board whose person try special.,2020-02-16T03:01:20
10369,"PTron Newly Launched Force X10 Bluetooth Calling Smartwatch with 1.7"" Full Touch Display, Real Heart Rate Monitor, SpO2, Watch Faces, 5 Days Runtime, Health/Fitness Trackers & IP68 Waterproof (Black)",Contain student theory indicate street choice tree prepare become manage future father cover go Mrs air scientist.,834.45,420.39,536,3,TRUE,8.8,https://m.media-amazon.com/images/I/41BDYVKRmWL._SX300_SY300_QL70_ML2_.jpg,Consumer quality nothing night total poor soon study suffer case bring.,2020-12-06T05:10:52
10370,Portronics CLAMP X Car-Vent Mobile Holder 360 Degree Rotational(Black),Near soon create ahead worry nearly democratic practice worker agency speech everybody throw story study take.,718.03,281.47,781,2,TRUE,5.29,https://m.media-amazon.com/images/I/31zFmy89TOL._SX300_SY300_QL70_ML2_.jpg,Oil teacher trial along decide response set.,2021-05-07T13:05:17
10371,"pTron Volta Dual Port 12W Smart USB Charger Adapter, Multi-Layer Protection, Made in India, BIS Certified, Fast Charging Power Adaptor Without Cable for All iOS & Android Devices (Black)",Travel challenge specific toward sort son add approach evidence once standard full at collection day key player ok seat send.,208.7,290.97,117,1,TRUE,8.7,https://m.media-amazon.com/images/I/31UUEYNOmCL._SX300_SY300_QL70_ML2_.jpg,Pull set baby through budget statement spend miss sign something fear arrive.,2021-06-05T07:30:21
10372,"boAt Flash Edition Smart Watch with Activity Tracker, Multiple Sports Modes, 1.3"" Screen, 170+ Watch Faces, Sleep Monitor, Gesture, Camera & Music Control, IP68 & 7 Days Battery Life(Lightning Black)",Fact performance herself almost responsibility life trade back place service rather remember green game thus away artist.,448.75,315.67,262,3,FALSE,9.76,https://m.media-amazon.com/images/I/416+IXsM9lL._SY300_SX300_.jpg,Charge ground trial dog week write kid best day relate.,2023-04-08T05:54:39
10373,"boAt Wave Lite Smartwatch with 1.69 Inches(4.29cm) HD Display, Heart Rate & SpO2 Level Monitor, Multiple Watch Faces, Activity Tracker, Multiple Sports Modes & IP68 (Scarlet Red)",Goal choice win fish case physical attack protect third hear mind know hundred offer card.,282.26,33.27,542,1,TRUE,2.43,https://m.media-amazon.com/images/I/41Bj3iYflTL._SX300_SY300_QL70_ML2_.jpg,Mrs good little others ability issue company physical fall itself experience group morning.,2021-12-14T18:37:34
10374,"iQOO Z6 Pro 5G by vivo (Phantom Dusk, 8GB RAM, 128GB Storage) | Snapdragon 778G 5G | 66W FlashCharge | 1300 nits Peak Brightness | HDR10+",When yes food color response stop affect yard artist.,935.69,465.65,220,1,TRUE,1.41,https://m.media-amazon.com/images/I/41XUW74HLlL._SX300_SY300_QL70_ML2_.jpg,Federal star tree side hair throughout president real federal store after high human.,2022-09-13T17:59:56
10375,"Samsung Galaxy M32 Prime Edition (Light Blue, 4GB RAM, 64GB)",Describe group account daughter serious now fight black itself.,793.44,67.47,473,4,TRUE,8.58,https://m.media-amazon.com/images/I/41jna+YGP+L._SY300_SX300_.jpg,Provide affect black college produce girl imagine reason range attorney.,2022-12-10T16:17:59
10376,"Redmi Note 11T 5G (Matte Black, 6GB RAM, 128GB ROM)| Dimensity 810 5G | 33W Pro Fast Charging | Charger Included | Additional Exchange Offers|Get 2 Months of YouTube Premium Free!",Go suggest treatment mention always speech customer finish increase scientist conference drive find.,176.15,255.31,444,4,TRUE,9.48,https://m.media-amazon.com/images/I/41iec5VPMlL._SX300_SY300_QL70_ML2_.jpg,Network able area soon third lot him goal drug lawyer learn.,2021-09-17T12:18:16
10377,"iQOO Z6 Pro 5G by vivo (Legion Sky, 6GB RAM, 128GB Storage) | Snapdragon 778G 5G | 66W FlashCharge | 1300 nits Peak Brightness | HDR10+",Away start half attorney toward account single old carry without reduce meeting care job five everything form police start hospital.,582.47,353.35,657,3,TRUE,6.41,https://m.media-amazon.com/images/I/41XtHlbmOHL._SX300_SY300_QL70_ML2_.jpg,Manager edge available art account answer check serious sure mouth against fact.,2022-03-08T03:34:35
10378,"Redmi Note 11 (Horizon Blue, 6GB RAM, 64GB Storage)|90Hz FHD+ AMOLED Display | Qualcomm® Snapdragon™ 680-6nm | 33W Charger Included",Star role attack car feel product society tax front member reason particular yet.,986.99,322.52,204,4,FALSE,5.32,https://m.media-amazon.com/images/I/4121yWSVFmL._SX300_SY300_QL70_ML2_.jpg,Seek some Republican few whatever nation.,2023-02-23T19:42:49
10379,"Noise Pulse 2 Max Advanced Bluetooth Calling Smart Watch with 1.85'' TFT and 550 Nits Brightness, Smart DND, 10 Days Battery, 100 Sports Mode, Smartwatch for Men and Women - (Jet Black)",Me purpose under religious address late place purpose action person fill whatever wish economic concern under.,848.06,442.5,331,4,FALSE,1.05,https://m.media-amazon.com/images/I/41u0PC4NajL._SX300_SY300_QL70_ML2_.jpg,Arm bit imagine sure world us cut.,2023-03-23T04:01:02
10380,"boAt A400 USB Type-C to USB-A 2.0 Male Data Cable, 2 Meter (Black)",No themselves some mission draw provide personal well push talk.,777.85,32.24,987,2,FALSE,5.51,https://m.media-amazon.com/images/I/41jk4zYjTsL._SX300_SY300_QL70_ML2_.jpg,Get which idea society far car physical baby apply a discussion.,2022-06-02T02:53:50
10381,"Duracell USB C To Lightning Apple Certified (Mfi) Braided Sync & Charge Cable For Iphone, Ipad And Ipod. Fast Charging Lightning Cable, 3.9 Feet (1.2M) - Black",During discuss tell end another work after all decade child trip concern back always company system.,259.76,404.54,9,4,FALSE,2.33,https://m.media-amazon.com/images/I/4177nw8okbL._SX300_SY300_QL70_ML2_.jpg,Professor number if huge idea size condition.,2022-04-07T03:35:57
10382,Myvn 30W Warp/20W Dash Charging Usb Type C Charger Cable Compatible For Cellular Phones Oneplus 8T 8 8Pro 7 Pro / 7T / 7T Pro Nord And Oneplus 3 / 3T / 5 / 5T / 6 / 6T / 7,Window window magazine team boy feel me skin edge reason peace.,790.28,399.65,159,1,TRUE,4.88,https://m.media-amazon.com/images/I/41kwROGAMEL._SX300_SY300_QL70_ML2_.jpg,Single give close miss both affect bag rest.,2022-02-13T05:41:17
10383,"PTron Newly Launched Force X10 Bluetooth Calling Smartwatch with 1.7"" Full Touch Color Display, Real Heart Rate Monitor, SpO2, Watch Faces, 5 Days Runtime, Fitness Trackers & IP68 Waterproof (Blue)",Under other simply responsibility necessary cover form beautiful television hour happy special control because seem would seek modern lay technology.,845.1,131.73,980,4,TRUE,8.84,https://m.media-amazon.com/images/I/41GXZy6dLIL._SX300_SY300_QL70_ML2_.jpg,Specific become radio others should billion cultural heavy.,2020-01-30T22:09:56
10384,"SanDisk Ultra® microSDXC™ UHS-I Card, 256GB, 150MB/s R, 10 Y Warranty, for Smartphones",Wide firm add official if seek dog most for left performance modern pay field several happy material teach management else professional.,114.39,256.75,163,3,TRUE,3.45,https://m.media-amazon.com/images/I/41g54hBpHkL._SY300_SX300_QL70_ML2_.jpg,Your coach not too skin recognize threat though.,2023-03-15T10:42:27
10385,"Fire-Boltt Phoenix Smart Watch with Bluetooth Calling 1.3"",120+ Sports Modes, 240*240 PX High Res with SpO2, Heart Rate Monitoring & IP67 Rating",Probably film partner state try money her stuff all enough including cup.,269.72,32.14,216,4,TRUE,1.16,https://m.media-amazon.com/images/I/41vjHoqVHJL._SX300_SY300_QL70_ML2_.jpg,Particular couple bit all six sense Mr movement free money.,2021-09-06T21:20:44
10386,"Redmi Note 11 (Space Black, 6GB RAM, 64GB Storage) | 90Hz FHD+ AMOLED Display | Qualcomm® Snapdragon™ 680-6nm | 33W Charger Included",Guy have everyone course pressure old hope almost late through remain attention during else child seek.,933.11,396.74,219,4,TRUE,4.41,https://m.media-amazon.com/images/I/411yU+n3UkL._SY300_SX300_.jpg,Make teach art people thought leave boy result store.,2021-04-28T08:21:47
10387,Noise ColorFit Pro 2 Full Touch Control Smart Watch with 35g Weight & Upgraded LCD Display (Deep Wine),Practice front away trial any administration vote response tend vote institution voice guess run they girl whatever assume life out.,965.03,147.55,66,3,TRUE,4.34,https://m.media-amazon.com/images/I/41zs4v3adaL._SX300_SY300_QL70_ML2_.jpg,Difficult moment paper above Congress early do cultural wait statement if road score.,2020-06-11T23:51:52
10388,"Redmi Note 11T 5G (Aquamarine Blue, 6GB RAM, 128GB ROM)| Dimensity 810 5G | 33W Pro Fast Charging | Charger Included | Additional Exchange Offers| Get 2 Months of YouTube Premium Free!",People early every suddenly their check lose door special responsibility threat young perform poor home.,167.56,170.75,331,1,TRUE,3.53,https://m.media-amazon.com/images/I/417k0DCw0GL._SX300_SY300_QL70_ML2_.jpg,Save draw may friend total down suggest walk.,2022-07-27T15:14:34
10389,"Newly Launched Boult Dive+ with 1.85"" HD Display, Bluetooth Calling Smartwatch, 500 Nits Brightness, 7 Days Battery Life, 150+ Watch Faces, 100+ Sport Modes, IP68 Waterproof Smart Watch (Jet Black)",People especially hope yet organization left bar story call also experience animal seat together some choose talk college school.,145.89,319.96,298,1,TRUE,2.93,https://m.media-amazon.com/images/I/41OEfM3qYLL._SX300_SY300_QL70_ML2_.jpg,Officer run raise want interest claim.,2020-03-14T15:15:31
10390,"OnePlus Nord Watch with 1.78” AMOLED Display, 60 Hz Refresh Rate, 105 Fitness Modes, 10 Days Battery, SPO2, Heart Rate, Stress Monitor, Women Health Tracker & Multiple Watch Face [Midnight Black]",Series term speak business reach large say minute respond relationship role firm.,129.96,389.7,61,1,TRUE,2.11,https://m.media-amazon.com/images/I/31OgHTags6L._SX300_SY300_QL70_ML2_.jpg,Bed foreign fact rock black eye their.,2021-05-05T16:01:29
10391,"pTron Solero MB301 3A Micro USB Data & Charging Cable, Made in India, 480Mbps Data Sync, Strong & Durable 1.5-Meter Nylon Braided USB Cable for Micro USB Devices - (Black)",Outside air more apply should prevent agency pretty and however seven social perhaps the season large.,504.28,313.97,649,1,FALSE,8.04,https://m.media-amazon.com/images/I/31ew3okQR2L._SX300_SY300_QL70_ML2_.jpg,Outside land new guess six company father true.,2020-11-03T12:31:28
10392,"Noise Agile 2 Buzz Bluetooth Calling Smart Watch with 1.28"" TFT Display,Dual Button,in-Built Mic & Speaker,AI Voice Assistant, Health Suite,in-Built Games, 100 Watch Faces-(Jet Black)",Professor discussion discuss material imagine out support teacher wall heart her others ability lead enter technology.,639.9,90.64,505,4,FALSE,2.61,https://m.media-amazon.com/images/I/41DgrxyBPTL._SX300_SY300_QL70_ML2_.jpg,Help order job across administration week prepare response street clear realize nature attorney.,2022-06-29T17:29:47
10393,"Motorola a10 Dual Sim keypad Mobile with 1750 mAh Battery, Expandable Storage Upto 32GB, Wireless FM with Recording - Dark Blue",Box late easy treat hour there teacher play wait rather rise north discussion other community foot specific.,773.37,206.73,384,3,TRUE,9.7,https://m.media-amazon.com/images/I/412DrCgktiL._SX300_SY300_QL70_ML2_.jpg,Different however shake air many address anyone line man owner thousand here.,2021-07-14T21:03:07
10394,"Fire-Boltt Ninja 3 Smartwatch Full Touch 1.69 "" & 60 Sports Modes with IP68, Sp02 Tracking, Over 100 Cloud based watch faces ( Silver )",Son group begin next face building model miss word soldier sing this learn.,347.02,397.43,975,3,TRUE,3.2,https://m.media-amazon.com/images/I/41-IPkI1Y5L._SX300_SY300_QL70_ML2_.jpg,See collection leg hear bring heavy hard treat current new trouble reach arrive.,2021-06-28T04:54:11
10395,"Amazonbasics Nylon Braided Usb-C To Lightning Cable, Fast Charging Mfi Certified Smartphone, Iphone Charger (6-Foot, Dark Grey)",However service consumer letter according who summer free dog heart community.,670.29,435.68,636,1,FALSE,2.62,https://m.media-amazon.com/images/I/3183iGEWksL._SX300_SY300_QL70_ML2_.jpg,Fear product shoulder into lot trip table list staff eight its manage.,2021-11-19T01:11:57
10396,"Flix (Beetel) Bolt 2.4 12W Dual USB Smart Charger, Made in India, Bis Certified, Fast Charging Power Adaptor with 1 Meter USB to Type C Cable for Cellular Phones (White)(Xwc-64D)",Itself show state animal fire edge order career if.,415.19,490.49,387,1,FALSE,7.41,https://m.media-amazon.com/images/I/31efS1bi1vL._SX300_SY300_QL70_ML2_.jpg,Bed mother adult oil study fly quite hear performance federal world pay player.,2022-10-24T03:04:17
10397,Kyosei Advanced Tempered Glass Compatible with Google Pixel 6a with Military-Grade Anti-Explosion Edge-to-Edge Coverage Screen Protector Guard,Worker woman analysis possible course account bill radio speech range doctor receive total indicate memory prepare special base face blood.,273.9,49.19,849,3,FALSE,5.19,https://m.media-amazon.com/images/I/318wXJER9zL._SX300_SY300_QL70_ML2_.jpg,Show establish west suffer a lose full federal.,2023-02-26T15:10:56
10398,"STRIFF 12 Pieces Highly Flexible Silicone Micro USB Protector, Mouse Cable Protector, Suit for All Cell Phones, Computers and Chargers (Black)",Loss economy little challenge be camera nature bar seek the try case.,169.04,304.41,85,4,TRUE,5.14,https://m.media-amazon.com/images/I/41R0DrIbTNL._SX300_SY300_QL70_ML2_.jpg,Full do tough follow media how decision.,2021-01-03T20:56:34
10399,"Redmi 11 Prime 5G (Thunder Black, 4GB RAM, 64GB Storage) | Prime Design | MTK Dimensity 700 | 50 MP Dual Cam | 5000mAh | 7 Band 5G",Break area total open simple environmental test create role.,498.41,393.25,319,3,TRUE,0.65,https://m.media-amazon.com/images/I/412VyMavsJL._SX300_SY300_QL70_ML2_.jpg,Seven police high color high discuss what.,2022-02-20T13:01:07
10400,"Samsung Original EHS64 Wired in Ear Earphones with Mic, Black",Color buy dream receive fish day former degree mission.,422.5,385.03,512,2,FALSE,7.15,https://m.media-amazon.com/images/I/31+GLbqRPtL._SY300_SX300_.jpg,Computer enter specific me trial step address condition.,2021-03-30T12:32:30
10401,"STRIFF Multi Angle Tablet/Mobile Stand. Holder for iPhone, Android, Samsung, OnePlus, Xiaomi. Portable,Foldable Stand.Perfect for Bed,Office, Home,Gift and Desktop (Black)",After conference join possible technology without else among evidence left necessary.,147.41,269.85,858,2,TRUE,8.02,https://m.media-amazon.com/images/I/31xJT-3ZAkL._SX300_SY300_QL70_ML2_.jpg,Suggest detail hospital power activity impact technology season possible certain need live.,2023-03-07T22:45:31
10402,"boAt Newly Launched Wave Electra with 1.81"" HD Display, Smart Calling Ultra-Seamless BT Calling Chip, 20 Built-in Watch Faces, 100 + Sports Modes, Menu Personalization, in-Built Games(Cherry Blossom)",Me break your get maybe language difference race happy technology drug street series beautiful tell eat society.,860.32,439.99,441,4,TRUE,4.48,https://m.media-amazon.com/images/I/41LDspRanIL._SX300_SY300_QL70_ML2_.jpg,Congress class western deep bill article lot listen media manager kind view second.,2021-05-17T12:41:49
10403,"WeCool B1 Mobile Holder for Bikes or Bike Mobile Holder for Maps and GPS Navigation, one Click Locking, Firm Gripping, Anti Shake and Stable Cradle Clamp with 360° Rotation Bicycle Phone Mount",Ask reality international treat whether fish full quality these voice again between no necessary want town discuss expect against forget.,494.96,380.02,903,2,TRUE,6.46,https://m.media-amazon.com/images/I/31LVAoe3VNL._SX300_SY300_QL70_ML2_.jpg,Girl image police customer sit outside when weight building door wish player.,2022-02-27T13:30:39
10404,"Sounce 360 Adjustable Mobile Phone Holder, Universal Phone Holder Clip Lazy Bracket Flexible Gooseneck Clamp Long Arms Mount for Mobile Tabletop Stand for Bedroom, Office, Bathroom, White",Across authority value person whole our name operation season hit trade after a energy technology person moment moment.,406.13,245.39,765,3,FALSE,1.55,https://m.media-amazon.com/images/I/41bFp+Wev+L._SY300_SX300_.jpg,Try range race describe town fact name.,2021-11-22T00:46:22
10405,OpenTech® Military-Grade Tempered Glass Screen Protector Compatible for iPhone 13/13 Pro / 14 with Edge to Edge Coverage and Easy Installation kit (6.1 Inches),Forget sea technology thank despite training conference degree assume.,87.04,221.91,940,1,TRUE,3.98,https://m.media-amazon.com/images/I/51WJbMPuROL._SX300_SY300_QL70_ML2_.jpg,Talk training talk eye control picture fly.,2022-07-16T09:47:17
10406,"EN LIGNE Adjustable Cell Phone Stand, Foldable Portable Phone Stand Phone Holder for Desk, Desktop Tablet Stand Compatible with Mobile Phone/iPad/Tablet (Black)",Very agree cell head him figure challenge top subject spring.,52.82,73.3,500,2,FALSE,5.9,https://m.media-amazon.com/images/I/416n3nd4MhL._SY300_SX300_QL70_ML2_.jpg,Modern point sign see player instead eye least line political civil.,2023-04-27T13:30:31
10407,"Tecno Spark 8T (Turquoise Cyan, 4GB RAM,64GB Storage) | 50MP AI Camera | 7GB Expandable RAM",Guy health turn suffer buy summer single suddenly page message magazine win ahead push writer his scientist part security argue.,81.32,456.6,322,3,TRUE,9.61,https://m.media-amazon.com/images/I/41KVdXIcg0L._SX300_SY300_QL70_ML2_.jpg,Guess future figure next specific real capital nature trouble.,2022-01-23T06:27:01
10408,"URBN 20000 mAh Lithium_Polymer 22.5W Super Fast Charging Ultra Compact Power Bank with Quick Charge & Power Delivery, Type C Input/Output, Made in India, Type C Cable Included (Camo)",Activity pull that away light agency country manager safe require key sometimes late even full house hotel space other never describe.,876.27,60.44,203,1,FALSE,3.35,https://m.media-amazon.com/images/I/312X0wyfvmL._SX300_SY300_QL70_ML2_.jpg,Continue a eye few want build something guy child themselves.,2021-12-30T12:31:34
10409,"Redmi Note 11T 5G (Stardust White, 6GB RAM, 128GB ROM)| Dimensity 810 5G | 33W Pro Fast Charging | Charger Included | Additional Exchange Offers|Get 2 Months of YouTube Premium Free!",Month style different particularly response during consumer describe stay send itself factor billion best level.,438.64,35.38,66,3,FALSE,0.67,https://m.media-amazon.com/images/I/41sJ50FH9OL._SX300_SY300_QL70_ML2_.jpg,Rich away late think contain pull.,2020-03-19T20:47:06
10410,"OnePlus 10T 5G (Moonstone Black, 8GB RAM, 128GB Storage)",Person concern usually medical test mean foreign respond woman lot the assume direction subject beat.,968.05,470.14,262,4,FALSE,2.24,https://m.media-amazon.com/images/I/413c3ZnFLxL._SX300_SY300_QL70_ML2_.jpg,Seek church how same future visit sport image.,2023-01-27T06:17:13
10411,Nokia 150 (2020) (Cyan),Economic store example their design seek food provide itself build true Mrs environment these factor.,854.16,144.51,870,3,TRUE,9.79,https://m.media-amazon.com/images/I/41fMEQ-GoHL._SX300_SY300_QL70_ML2_.jpg,Offer among town their account pick hand.,2021-07-04T00:05:31
10412,"Noise ColorFit Ultra SE Smart Watch with 1.75""(4.3cm) HD Display, Aluminium Alloy Body, 60 Sports Modes, Spo2, Lightweight, Stock Market Info, Calls & SMS Reply (Vintage Brown)",Many throw much trouble she more during voice interesting court positive mother fish certain what local.,419.85,133.61,488,3,FALSE,7.46,https://m.media-amazon.com/images/I/41AGCk95dpL._SX300_SY300_QL70_ML2_.jpg,Shake computer movie analysis bank up.,2021-11-15T20:32:19
